<?xml version="1.0" encoding="UTF-8"?>
<!--
/**
 * Copyright Â© 2015 Magento. All rights reserved.
 * See COPYING.txt for license details.
 */
-->
<xs:schema xmlns:xs="http://www.w3.org/2001/XMLSchema">
    <xs:redefine schemaLocation="../Magento/Mtf/Data/etc/types.xsd">
        <xs:complexType name="argumentType" mixed="false">
            <xs:complexContent>
                <xs:extension base="argumentType" />
            </xs:complexContent>
        </xs:complexType>
    </xs:redefine>

    <xs:element name="config">
        <xs:annotation>
            <xs:documentation>
                The root element for configuration data.
            </xs:documentation>
        </xs:annotation>
        <xs:complexType>
            <xs:sequence>
                <xs:element ref="testCase" maxOccurs="unbounded" minOccurs="1">
                    <xs:annotation>
                        <xs:documentation>
                            An element that contains configuration data of a test case.
                        </xs:documentation>
                    </xs:annotation>
                </xs:element>
            </xs:sequence>
        </xs:complexType>
    </xs:element>

    <xs:element name="testCase">
        <xs:complexType>
            <xs:sequence>
                <xs:element ref="variation" maxOccurs="unbounded" minOccurs="1">
                    <xs:annotation>
                        <xs:documentation>
                            An element that contains configuration data of a test case variation.
                        </xs:documentation>
                    </xs:annotation>
                </xs:element>
            </xs:sequence>
            <xs:attribute type="xs:string" name="name" use="required" />
            <xs:attribute type="xs:string" name="summary" use="required" />
            <xs:attribute type="xs:string" name="ticketId" use="optional" />
        </xs:complexType>
    </xs:element>

    <xs:element name="variation">
        <xs:complexType>
            <xs:choice minOccurs="0" maxOccurs="unbounded">
                <xs:element name="data" type="argumentType" maxOccurs="unbounded" minOccurs="0">
                    <xs:annotation>
                        <xs:documentation>
                            An element that contains a single configuration data set of a test case variation.
                        </xs:documentation>
                    </xs:annotation>
                </xs:element>
                <xs:element ref="constraint" maxOccurs="unbounded" minOccurs="0">
                    <xs:annotation>
                        <xs:documentation>
                            An element that contains a constraint className and order.
                        </xs:documentation>
                    </xs:annotation>
                </xs:element>
            </xs:choice>
            <xs:attribute type="xs:string" name="name" use="required" />
            <xs:attribute type="xs:string" name="replace" use="optional" />
            <xs:attribute type="xs:string" name="firstConstraint" use="optional" />
            <xs:attribute type="xs:string" name="method" use="optional" />
            <xs:attribute type="xs:string" name="summary" use="optional" />
            <xs:attribute type="xs:string" name="ticketId" use="optional" />
        </xs:complexType>
    </xs:element>

    <xs:element name="constraint">
        <xs:complexType>
            <xs:attribute type="xs:string" name="name" use="required" />
            <xs:attribute type="xs:string" name="next" use="optional" />
            <xs:attribute type="xs:string" name="prev" use="optional" />
        </xs:complexType>
    </xs:element>
</xs:schema>